Commit Message,Author,PR Link,Team,Change Type
chore: Remove PortfolioView feature flags (#31501),Nick Gambino,https://github.com/MetaMask/metamask-extension/pull/31501,team-assets,,Added
feat: update native balance by address (#31510),Salim TOUBAL,https://github.com/MetaMask/metamask-extension/pull/31510,team-assets,,Added
fix: fix button disabled for long tokenId (#31359),sahar-fehri,https://github.com/MetaMask/metamask-extension/pull/31359,team-assets,,Fixed
fix: handle array image edge cases (#30494),Prithpal Sooriya,https://github.com/MetaMask/metamask-extension/pull/30494,team-assets,,Fixed
refactor: migrate tokenRates controller to modular controller init (#31254),Salim TOUBAL,https://github.com/MetaMask/metamask-extension/pull/31254,team-assets,,Changed
style: Update color of values to text-default (#30886),Amanda Yeoh,https://github.com/MetaMask/metamask-extension/pull/30886,team-assets,,Unknown
fix: token name sort  (#31302),Nick Gambino,https://github.com/MetaMask/metamask-extension/pull/31302,team-assets,,Fixed
style: Update tabs color hover and animations (#30907),Amanda Yeoh,https://github.com/MetaMask/metamask-extension/pull/30907,team-assets,,Unknown
chore: cherry-pick fix: HW wallet confirmation warning for bridge into v12.16.0 (#31740),Derek Brans,https://github.com/MetaMask/metamask-extension/pull/31740,team-extension-platform,,Ops
chore: master sync (after v12.15.2) (#31720),Mark Stacey,https://github.com/MetaMask/metamask-extension/pull/31720,team-extension-platform,,Changed
yarn lint:changelog (#31722),Derek Brans,https://github.com/MetaMask/metamask-extension/pull/31722,team-extension-platform,,Unknown
fix: Revert "feat(14507): improve error message for failed txn in activity… (#31137),Derek Brans,https://github.com/MetaMask/metamask-extension/pull/31137,team-extension-platform,,Added
fix: CI for external contributions (#31566),Norbert Elter,https://github.com/MetaMask/metamask-extension/pull/31566,team-extension-platform,,Fixed
test: ensure `foundryup` works when bin path contains a space character (#31577),David Murdoch,https://github.com/MetaMask/metamask-extension/pull/31577,team-extension-platform,,Changed
fix: sanitizeTestTitle (#31574),Norbert Elter,https://github.com/MetaMask/metamask-extension/pull/31574,team-extension-platform,,Fixed
chore: Sync `main` with `master` `v12.15.0` -> `v12.15.1` (#31581),Mark Stacey,https://github.com/MetaMask/metamask-extension/pull/31581,team-extension-platform,,Changed
feat: add runway api (#31524),Norbert Elter,https://github.com/MetaMask/metamask-extension/pull/31524,team-extension-platform,,Added
feat: webpack chrome e2e on gha (#31363),Norbert Elter,https://github.com/MetaMask/metamask-extension/pull/31363,team-extension-platform,,Added
chore: sync `master` with `main` `v12.14.2` -> `v12.15.0` (#31495),Mark Stacey,https://github.com/MetaMask/metamask-extension/pull/31495,team-extension-platform,,Changed
fix: should not auto-close notification window if loaded in a tab (#30970),Derek Brans,https://github.com/MetaMask/metamask-extension/pull/30970,team-extension-platform,,Fixed
fix: cp-12.15.0 remove sentry cdn url from sentry script (#31360),David Murdoch,https://github.com/MetaMask/metamask-extension/pull/31360,team-extension-platform,,Fixed
test: fix mocha vs jest type conflicts in test files (#31049),Derek Brans,https://github.com/MetaMask/metamask-extension/pull/31049,team-extension-platform,,Changed
feat(remote-mode): add feature slide (#31463),Luis Taniça,https://github.com/MetaMask/metamask-extension/pull/31463,team-vault,,Added
chore(remote-mode): add getIsRemoteModeEnabled selector (#31334),Luis Taniça,https://github.com/MetaMask/metamask-extension/pull/31334,team-vault,,Changed
fix: cp-12.16.0 bump "@metamask/smart-transactions-controller": "^16.3.1" (#31668),Daniel,https://github.com/MetaMask/metamask-extension/pull/31668,team-transactions,,Ops
fix: cp-12.16.0 Follow up on the publishBatch hook (#31401),Daniel,https://github.com/MetaMask/metamask-extension/pull/31401,team-transactions,,Fixed
feat: Implement the publishBatch hook for smart transactions (#31267),Daniel,https://github.com/MetaMask/metamask-extension/pull/31267,team-transactions,,Added
New Crowdin translations by Github Action (#30815),MetaMask Bot,https://github.com/MetaMask/metamask-extension/pull/30815,team-bot,,Unknown
chore: add workflow_dispatch to security-code-scanner (#30620),MetaMask Bot,https://github.com/MetaMask/metamask-extension/pull/30620,team-bot,,Changed