Commit Message,Author,PR Link,Team,Change Type
fix: improve mark as read (#31824),Prithpal Sooriya,https://github.com/MetaMask/metamask-extension/pull/31824,team-assets,,Fixed
chore: bump solana wallet snap to v1.22.0 (#32043),sahar-fehri,https://github.com/MetaMask/metamask-extension/pull/32043,team-assets,,Ops
fix: fix rerender for suggested nfts (#32031),sahar-fehri,https://github.com/MetaMask/metamask-extension/pull/32031,team-assets,,Fixed
fix: NFT Grid tooltip (#31625),Nick Gambino,https://github.com/MetaMask/metamask-extension/pull/31625,team-assets,,Fixed
fix: cp-12.16.1 fix display nft full image (#31967),sahar-fehri,https://github.com/MetaMask/metamask-extension/pull/31967,team-assets,,Fixed
chore: upgrade assets controllers to v56 (#31762),Salim TOUBAL,https://github.com/MetaMask/metamask-extension/pull/31762,team-assets,,Changed
fix: fix sentry error on getNetworkConfigurationByNetworkClientId (#31438),Salim TOUBAL,https://github.com/MetaMask/metamask-extension/pull/31438,team-assets,,Fixed
style: Update carousel styling and images (#31687),Amanda Yeoh,https://github.com/MetaMask/metamask-extension/pull/31687,team-assets,,Unknown
fix: cp-12.17.0 fix clean up fiat conversion logic (#31938),Salim TOUBAL,https://github.com/MetaMask/metamask-extension/pull/31938,team-assets,,Fixed
fix: filter NFTs on send flow (#31850),sahar-fehri,https://github.com/MetaMask/metamask-extension/pull/31850,team-assets,,Fixed
cherry-pick 12.16.0: filter NFTs on send flow (#31850) (#31861),Nick Gambino,https://github.com/MetaMask/metamask-extension/pull/31861,team-assets,,Ops
fix: filter NFTs on send flow (#31850),sahar-fehri,https://github.com/MetaMask/metamask-extension/pull/31850,team-assets,,Fixed
fix: trigger detectNfts on account switch (#31481),sahar-fehri,https://github.com/MetaMask/metamask-extension/pull/31481,team-assets,,Fixed
fix: bump `@metamask/providers` version to v22.0.1 which contains fix to catch errors thrown when window.ethereum provider is set before we get to it (#32175),Alex Donesky,https://github.com/MetaMask/metamask-extension/pull/32175,team-wallet-api-platform,,Ops
feat: multichain api analytics (#32013),Alex Donesky,https://github.com/MetaMask/metamask-extension/pull/32013,team-wallet-api-platform,,Added
cherry-pick: fix(snaps): Temporarily replace `withKeyring` in `MultichainRouter` hook (#32120) (#32128),Alex Donesky,https://github.com/MetaMask/metamask-extension/pull/32128,team-wallet-api-platform,,Ops
feat: bump `@metamask/providers` to `^21.0.0` (#31056) (#32124),jiexi,https://github.com/MetaMask/metamask-extension/pull/32124,team-wallet-api-platform,,Added
feat: replace `caip-x` with `caip-348` for CAIP-294 announcement and Multichain API externally_connectable protocol (#32070),jiexi,https://github.com/MetaMask/metamask-extension/pull/32070,team-wallet-api-platform,,Added
feat: bump multichain-api-client 0.2.0 (#32104) (#32113),jiexi,https://github.com/MetaMask/metamask-extension/pull/32113,team-wallet-api-platform,,Added
feat: bump `@metamask/providers` to `^21.0.0` (#31056),jiexi,https://github.com/MetaMask/metamask-extension/pull/31056,team-wallet-api-platform,,Added
feat: bump multichain-api-client 0.2.0 (#32104),jiexi,https://github.com/MetaMask/metamask-extension/pull/32104,team-wallet-api-platform,,Added
feat: expose Multichain API via window.postMessage for Firefox (#30142),jiexi,https://github.com/MetaMask/metamask-extension/pull/30142,team-wallet-api-platform,,Added
feat: Add "Create Solana Account" in connection flow when Solana is requested chain by dapp (#31781),Alex Donesky,https://github.com/MetaMask/metamask-extension/pull/31781,team-wallet-api-platform,,Added
cherry-pick 12.17.0: enable review permissions for non EVM networks (#31825) (#31854),jiexi,https://github.com/MetaMask/metamask-extension/pull/31854,team-wallet-api-platform,,Ops
feat: Solana Wallet Standard (#31705) (#31847),Alex Donesky,https://github.com/MetaMask/metamask-extension/pull/31847,team-wallet-api-platform,,Added
feat: enable review permissions for non EVM networks (#31825),jiexi,https://github.com/MetaMask/metamask-extension/pull/31825,team-wallet-api-platform,,Added
fix: cp-12.17.0 cherry-pick auto create solana account after ondboarding or srp import (#32038) (#32098),Patryk Łucka,https://github.com/MetaMask/metamask-extension/pull/32098,team-mmi,,Ops
feat: auto create solana account after ondboarding or srp import cp-12.17.0 (#32038),Patryk Łucka,https://github.com/MetaMask/metamask-extension/pull/32038,team-mmi,,Added
fix: do not wait for snapclient response on account create (#31940),Patryk Łucka,https://github.com/MetaMask/metamask-extension/pull/31940,team-mmi,,Fixed
feat: update padding on the add account screen (#31936),Patryk Łucka,https://github.com/MetaMask/metamask-extension/pull/31936,team-mmi,,Added
(cherry-pick) feat: add discover solana accounts (#31931),Patryk Łucka,https://github.com/MetaMask/metamask-extension/pull/31931,team-mmi,,Added
feat: add calls to discover accounts (#31485),Patryk Łucka,https://github.com/MetaMask/metamask-extension/pull/31485,team-mmi,,Added
feat: add is_suggested_name segment property (#31513),Patryk Łucka,https://github.com/MetaMask/metamask-extension/pull/31513,team-mmi,,Added
feat: cp-12.17.0 - add Solana devnet (#32116),Gustavo Antunes,https://github.com/MetaMask/metamask-extension/pull/32116,team-accounts,,Added
chore: rename migration 154 to 152.1 (#32109),Gustavo Antunes,https://github.com/MetaMask/metamask-extension/pull/32109,team-accounts,,Changed
feat: add non EVM testnets (#31702),Gustavo Antunes,https://github.com/MetaMask/metamask-extension/pull/31702,team-accounts,,Added
chore: bump accounts-controller package (#31704),Charly Chevalier,https://github.com/MetaMask/metamask-extension/pull/31704,team-accounts,,Ops
fix: display first party snap accounts in srp account list. (#31833),Monte Lai,https://github.com/MetaMask/metamask-extension/pull/31833,team-accounts,,Fixed
feat: multi srp banner (#31782),Monte Lai,https://github.com/MetaMask/metamask-extension/pull/31782,team-accounts,,Added
fix: clear hidden accounts on restore and account list scroll (#31745),Gustavo Antunes,https://github.com/MetaMask/metamask-extension/pull/31745,team-accounts,,Fixed
fix: cp-12.16.0 activity tab (#31567),Dario Anongba Varela,https://github.com/MetaMask/metamask-extension/pull/31567,team-accounts,,Fixed
chore: improving disabled functionality to tabs component (#32081),George Marshall,https://github.com/MetaMask/metamask-extension/pull/32081,team-design-system,,Changed
chore: update notification popup width from 360px to 400px (#31960),George Marshall,https://github.com/MetaMask/metamask-extension/pull/31960,team-design-system,,Changed
chore: clean up tech debt for `MegaETH Testnet` integration (#31867),Stanley Yuen,https://github.com/MetaMask/metamask-extension/pull/31867,team-network-enablement,,Changed
chore: change the ordering for test networks (#31827),Stanley Yuen,https://github.com/MetaMask/metamask-extension/pull/31827,team-network-enablement,,Changed
chore(runway): cherry-pick fix: cp-12.16.0 carousel fix (#31780),Stanley Yuen,https://github.com/MetaMask/metamask-extension/pull/31780,team-network-enablement,,Ops
feat: INFRA-2406: Automated RCA questionaire workflow (#31665),Pavel Dvorkin,https://github.com/MetaMask/metamask-extension/pull/31665,team-dev-ops,,Added
feat: improved e2e test report (#31323),João,https://github.com/MetaMask/metamask-extension/pull/31323,team-dev-ops,,Added
fix: keyboard shortcut(Alt+Shift+M) broken on Chrome (#31844),Teng,https://github.com/MetaMask/metamask-extension/pull/31844,Unknown,,Fixed
chore: chore/12.16.0-Changelog (#31368),MetaMask Bot,https://github.com/MetaMask/metamask-extension/pull/31368,team-bot,,Changed
feat: Solana Wallet Standard (#31705),Baptiste Marchand,https://github.com/MetaMask/metamask-extension/pull/31705,team-wallet-standard,,Added