Commit Message,Author,PR Link,Team,Change Type
test: [POM] Privacy Mode spec (#29263),seaona,https://github.com/MetaMask/metamask-extension/pull/29263,team-qa,Changed
fix: fix permissions not correctly being updated when all network clients are removed for a chainId (#29855),jiexi,https://github.com/MetaMask/metamask-extension/pull/29855,team-wallet-api-platform,Fixed
fix: Fix bug where testnets do not show up correctly in the incremental permission view (#29864),jiexi,https://github.com/MetaMask/metamask-extension/pull/29864,team-wallet-api-platform,Changed
chore: bump `@metamask/multichain` to `^2.1.0` (#29861),jiexi,https://github.com/MetaMask/metamask-extension/pull/29861,team-wallet-api-platform,Ops
refactor: remove unused `startApprovalFlow` and `endApprovalFlow` hooks from `wallet_addEthereumChain` and `wallet_switchEthereumChain` (#28189),jiexi,https://github.com/MetaMask/metamask-extension/pull/28189,team-wallet-api-platform,Changed
feat: Migrate eth_accounts and permittedChains to CAIP-25 endowment (#27847),jiexi,https://github.com/MetaMask/metamask-extension/pull/27847,team-wallet-api-platform,Added
test: Remove unused `restrictReturnedAccounts` param option (#29767),jiexi,https://github.com/MetaMask/metamask-extension/pull/29767,team-wallet-api-platform,Changed
test: Cleanup snap-account-signature e2e tests. Add permittedChains scenario to wallet_revokePermissions e2e test (#29761),jiexi,https://github.com/MetaMask/metamask-extension/pull/29761,team-wallet-api-platform,Changed
fix: Fix `EditAccountsModal` and `EditNetworkModal` checkboxes reseting back to default on rerender (#29755),jiexi,https://github.com/MetaMask/metamask-extension/pull/29755,team-wallet-api-platform,Fixed
test: Fix flask user-operations e2e test setup (#29675),jiexi,https://github.com/MetaMask/metamask-extension/pull/29675,team-wallet-api-platform,Changed
test: add fixture permission controller test dapp two accounts (#29671),jiexi,https://github.com/MetaMask/metamask-extension/pull/29671,team-wallet-api-platform,Changed
refactor: remove unused end param in ethereum-chain-util helpers (#29619),jiexi,https://github.com/MetaMask/metamask-extension/pull/29619,team-wallet-api-platform,Changed
test: Remove obsolete permitted chains feature flag tests (#29618),jiexi,https://github.com/MetaMask/metamask-extension/pull/29618,team-wallet-api-platform,Added
chore: Remove toggle to turn on/off Per Dapp Selected Network Feature (#29301),Alex Donesky,https://github.com/MetaMask/metamask-extension/pull/29301,team-wallet-api-platform,Changed
test: remove MMI tests (#29748),Shane T,https://github.com/MetaMask/metamask-extension/pull/29748,team-mmi,Changed
chore: rm bridge dest token list (#29683),Micaela Estabillo,https://github.com/MetaMask/metamask-extension/pull/29683,team-bridge,Changed
fix: handle undefined token address in useBridging hook (#29832),Micaela Estabillo,https://github.com/MetaMask/metamask-extension/pull/29832,team-bridge,Fixed
chore: retain src input amount after switching tokens (#29709),Micaela Estabillo,https://github.com/MetaMask/metamask-extension/pull/29709,team-bridge,Changed
chore: remove bridge src token list from controller state (#29492),Micaela Estabillo,https://github.com/MetaMask/metamask-extension/pull/29492,team-bridge,Changed
fix: focused search field forces scroll (#29676),Micaela Estabillo,https://github.com/MetaMask/metamask-extension/pull/29676,team-bridge,Fixed
chore: low return warning alert for bridging (#29171),micaelae,https://github.com/MetaMask/metamask-extension/pull/29171,team-bridge,Changed
refactor: shared bridge types (#29254),micaelae,https://github.com/MetaMask/metamask-extension/pull/29254,team-bridge,Changed
fix: sentry e2e test for bridge tokens loading status (#29285),micaelae,https://github.com/MetaMask/metamask-extension/pull/29285,team-bridge,Changed
chore: quote timeout treatment for bridging (#29172),micaelae,https://github.com/MetaMask/metamask-extension/pull/29172,team-bridge,Changed
feat: adds fiat value to the swap totoken display (#29788),hunty,https://github.com/MetaMask/metamask-extension/pull/29788,Unknown,Added
feat: improve xchain swaps slippage settings with decimals and warnings (#29617),hunty,https://github.com/MetaMask/metamask-extension/pull/29617,Unknown,Added
feat: SOL-46 Adds tx history via multichain transactions controller (#29129),António Regadas,https://github.com/MetaMask/metamask-extension/pull/29129,team-sol,Added
chore: skips failing tests (#29778),António Regadas,https://github.com/MetaMask/metamask-extension/pull/29778,team-sol,Changed
feat: bump solana snap (#29350),Alejandro Garcia Anglada,https://github.com/MetaMask/metamask-extension/pull/29350,team-sol,Added
fix: remove network picker from non evm accounts (#29247),Alejandro Garcia Anglada,https://github.com/MetaMask/metamask-extension/pull/29247,team-sol,Fixed
chore(CI): Add hints whether webapp policy files diffs differ (#29657),Zbyszek Tenerowicz,https://github.com/MetaMask/metamask-extension/pull/29657,team-lavamoat,Changed
feat(lavamoat/lavadome): update integration to improve security (#25653),weizman,https://github.com/MetaMask/metamask-extension/pull/25653,team-lavamoat,Added
chore: add the new policy.json review process documentation and config (#29383),Zbyszek Tenerowicz,https://github.com/MetaMask/metamask-extension/pull/29383,team-lavamoat,Changed
chore: Update lavamoat to a version with more diff-friendly policy ordering (#29311),Zbyszek Tenerowicz,https://github.com/MetaMask/metamask-extension/pull/29311,team-lavamoat,Changed
feat: build beta (#29712),Norbert Elter,https://github.com/MetaMask/metamask-extension/pull/29712,team-extension-platform,Added
feat(3744): Implement feature Flag Values with Scope Based on threshold (#29081),Danica Shen,https://github.com/MetaMask/metamask-extension/pull/29081,team-extension-platform,Added
"feat: run the ""Main"" workflow on release branches (#29704)",Norbert Elter,https://github.com/MetaMask/metamask-extension/pull/29704,team-extension-platform,Added
feat: lint-workflows (#29643),Norbert Elter,https://github.com/MetaMask/metamask-extension/pull/29643,team-extension-platform,Added
chore: clarifying comments for some github actions (#29642),Norbert Elter,https://github.com/MetaMask/metamask-extension/pull/29642,team-extension-platform,Changed
feat: runway (#29632),Norbert Elter,https://github.com/MetaMask/metamask-extension/pull/29632,team-extension-platform,Added
fix: center pixel art in `no-nfts.svg` and remove use of embedded png (#29290),David Murdoch,https://github.com/MetaMask/metamask-extension/pull/29290,team-extension-platform,Fixed
fix: use correct color for bitcoin logo and remove the svg's embedded  PNG (#29292),David Murdoch,https://github.com/MetaMask/metamask-extension/pull/29292,team-extension-platform,Fixed
build: remove unused `info-fox.svg` (#29294),David Murdoch,https://github.com/MetaMask/metamask-extension/pull/29294,team-extension-platform,Unknown
fix: metamaskbot comment nits (#29636),Norbert Elter,https://github.com/MetaMask/metamask-extension/pull/29636,team-extension-platform,Fixed
feat(14507): improve error message for failed txn in activity details view (#29338),Danica Shen,https://github.com/MetaMask/metamask-extension/pull/29338,team-extension-platform,Added
fix(28081): design tweak for network badge (#29324),Danica Shen,https://github.com/MetaMask/metamask-extension/pull/29324,team-extension-platform,Fixed
fix(29226): fix error for undefined unitInput for sending NFT (#29386),Danica Shen,https://github.com/MetaMask/metamask-extension/pull/29386,team-extension-platform,Fixed
refactor: remove duplication of selectors in `selectors/confirm-transaction.js` (#27641),David Murdoch,https://github.com/MetaMask/metamask-extension/pull/27641,team-extension-platform,Changed
fix(26772): improve helptext for sending NFTs (#29296),Danica Shen,https://github.com/MetaMask/metamask-extension/pull/29296,team-extension-platform,Fixed
refactor: move `getCurrentCurrency` from `ui/selectors/selectors.js` to `ui/ducks/metamask/metamask.js` (#27648),David Murdoch,https://github.com/MetaMask/metamask-extension/pull/27648,team-extension-platform,Changed
fix(27140): fix styles for Slippage Tolerance Button Group in Transaction Settings Modal (#29246),Danica Shen,https://github.com/MetaMask/metamask-extension/pull/29246,team-extension-platform,Fixed
build: update the patches applied in the package.json (#29807),Prithpal Sooriya,https://github.com/MetaMask/metamask-extension/pull/29807,team-notifications,Unknown
feat: add some authentication state to sentry logs (#29432),Prithpal Sooriya,https://github.com/MetaMask/metamask-extension/pull/29432,team-notifications,Added
fix: handle notification api calls settings (#29327),Prithpal Sooriya,https://github.com/MetaMask/metamask-extension/pull/29327,team-notifications,Fixed
fix: update eth-ledger-keyring-bridge lib to fix web pack issue. (#29722),Xiaoming Wang,https://github.com/MetaMask/metamask-extension/pull/29722,team-hardware-wallets,Fixed
fix: upgrade @metamask/eth-ledger-bridge-keyring library to latest (#29687),Xiaoming Wang,https://github.com/MetaMask/metamask-extension/pull/29687,team-hardware-wallets,Changed
feat: Enable Ledger clear signing feature (#28909),Xiaoming Wang,https://github.com/MetaMask/metamask-extension/pull/28909,team-hardware-wallets,Added
fix: add prefix to account sync error message (#29718),Mathieu Artu,https://github.com/MetaMask/metamask-extension/pull/29718,team-identity,Fixed
fix: account syncing was not working after upgrading from a previous version (#29701),Mathieu Artu,https://github.com/MetaMask/metamask-extension/pull/29701,team-identity,Changed
feat: add auto sign-in for existing users (#29654),Mathieu Artu,https://github.com/MetaMask/metamask-extension/pull/29654,team-identity,Added
feat: add sentry error logging to account syncing erroneous situations (#29692),Mathieu Artu,https://github.com/MetaMask/metamask-extension/pull/29692,team-identity,Added
fix: condition for signing in a user after onboarding (#29659),Mathieu Artu,https://github.com/MetaMask/metamask-extension/pull/29659,team-identity,Fixed
chore: bump `@metamask/profile-sync-controller` to `v3.2.0` (#29598),Mathieu Artu,https://github.com/MetaMask/metamask-extension/pull/29598,team-identity,Ops
fix: Add main frame URL property to req object whenever req is triggered from an iframe (#29337),AugmentedMode,https://github.com/MetaMask/metamask-extension/pull/29337,team-product-safety,Fixed
chore: updating menu item to use text component (#29304),George Marshall,https://github.com/MetaMask/metamask-extension/pull/29304,team-design-system,Changed
chore: fix security settings layout (#29258),George Marshall,https://github.com/MetaMask/metamask-extension/pull/29258,team-design-system,Changed
fix: add focus state to swaps input for improved accessibility (#29252),George Marshall,https://github.com/MetaMask/metamask-extension/pull/29252,team-design-system,Fixed